{
  "schema_version": "1.0.0",
  "amendment": {
    "id": "PCQ-1.3",
    "protocol_id": "PCQ-1",
    "protocol_version": "0.2.0",
    "created_date": "2026-09-05",
    "status": "locked-before-participant-level-outcome-access",
    "baseline_commit": "c7d1e374949c5e9b085679127356a76ddb7c821e",
    "analysis_plan_id": "pcq-analysis-plan-1.0.0",
    "parent_protocol": {
      "path": "data/qualification/pulmonary-capillary-qualification-protocol-v1.json",
      "sha256": "d2de34b8a99a6ebf5e180d2c63f4a3fe09b6c73fec8263909a9bf6a2682614ef"
    },
    "candidate_register": {
      "path": "data/qualification/pulmonary-capillary-evidence-candidate-register-v1.json",
      "sha256": "40f94e63abcb13e9d292efec3e38270a61879107890e6c6fb03fe782cc98cb14"
    },
    "outcome_access": "No candidate participant-level outcome record had been downloaded, received, or inspected when this amendment was written.",
    "public_outcome_exposure": "Published aggregate means, spreads, figures, and repeatability results were visible during PCQ-1.2. The limits below are fixed from method repeatability, existing reconstruction sensitivity, conservative model-discrepancy choices, and precision rules; they were not tuned to make any published candidate outcome pass.",
    "review_status": "internally reviewed; independent domain-method review requested before locked execution",
    "clinical_use": false
  },
  "selected_sources": [
    {
      "candidate_id": "PCQ-SRC-H-001",
      "tracks": ["PCQ-H"],
      "role": "primary-pilot-and-confirmatory-if-sample-sufficient",
      "status": "access-and-rights-pending",
      "activation_requirements": [
        "healthy-control phenotype confirmed per participant",
        "age, posture, stage timing, pressure reference, and cardiac-output method supplied",
        "at least three complete same-stage mPAP, PAWP, and cardiac-output tuples",
        "source rights permit the declared analysis and aggregate publication"
      ]
    },
    {
      "candidate_id": "PCQ-SRC-R-002",
      "tracks": ["PCQ-R"],
      "role": "provisional-primary-five-lobe-source",
      "status": "feasibility-access-and-rights-pending",
      "activation_requirements": [
        "five lobe contributions available for the same healthy participant and posture",
        "normalization and lobe segmentation are documented",
        "participant-level covariance or sufficient replicate information is supplied",
        "source rights permit the declared analysis and aggregate publication"
      ]
    },
    {
      "candidate_id": "PCQ-SRC-CJ-001",
      "tracks": ["PCQ-C", "PCQ-J"],
      "role": "primary-functional-volume-and-partial-joint-source",
      "status": "access-and-rights-pending",
      "activation_requirements": [
        "same-stage Vc and cardiac output are available",
        "measured hemoglobin and the applied correction are documented",
        "baseline posture and condition ordering are confirmed",
        "source rights permit the declared analysis and aggregate publication"
      ]
    },
    {
      "candidate_id": "PCQ-SRC-C-003",
      "tracks": ["PCQ-C"],
      "role": "provisional-whole-pulmonary-transit-source",
      "status": "observation-model-blocked-and-access-pending",
      "activation_requirements": [
        "participant-level pulmonary-trunk-to-left-atrium transit and repeatability records are permitted",
        "an independent model supplies precapillary, postcapillary, and mixing-delay terms without fitting them to Lassen outcomes",
        "tracer-retention bias is handled in a one-sided sensitivity analysis",
        "algebraically derived pulmonary blood volume is excluded as independent closure evidence"
      ]
    }
  ],
  "analysis_sets": [
    {
      "track": "PCQ-H",
      "primary_population": "healthy adults aged 20 through 40 years in supine or recumbent incremental exercise",
      "primary_state": "rest and at least two ordered exercise stages in one visit",
      "minimum_complete_participants_for_bounded_pilot": 3,
      "minimum_complete_participants_for_track_decision": 10,
      "minimum_complete_stages_per_participant": 3,
      "insufficient_precision_rule": "Three through nine eligible participants permit only a pilot compatibility report; fewer than three are insufficient. Neither state may be described as a completed PCQ-H qualification."
    },
    {
      "track": "PCQ-R",
      "primary_population": "healthy adults aged 20 through 40 years with anatomically assigned five-lobe perfusion",
      "primary_state": "supine or recumbent rest; erect administration and exercise are separate extensions",
      "minimum_complete_participants_for_bounded_pilot": 5,
      "minimum_complete_participants_for_track_decision": 10,
      "minimum_complete_stages_per_participant": 1,
      "insufficient_precision_rule": "Aggregate-only data or fewer than ten complete participants remain supportive or pilot evidence and cannot close participant-level PCQ-R."
    },
    {
      "track": "PCQ-C",
      "primary_population": "healthy adults aged 20 through 40 years in a recumbent or semirecumbent state",
      "primary_state": "baseline rest; exercise and adenosine are separately reported extensions",
      "minimum_complete_participants_for_bounded_pilot": 8,
      "minimum_complete_participants_for_track_decision": 12,
      "minimum_complete_stages_per_participant": 1,
      "insufficient_precision_rule": "A source can remain informative when the minimum is missed, but an equivalence interval that is too wide is inconclusive rather than a pass or a model failure. PCQ-C cannot close while PCQ-C2 remains observation-model blocked."
    },
    {
      "track": "PCQ-J",
      "primary_population": "the eligible intersection of the PCQ-H, PCQ-R, and PCQ-C analysis sets",
      "primary_state": "only same-participant and same-stage measurements, or an explicitly partial cross-cohort bridge",
      "minimum_complete_participants_for_bounded_pilot": 0,
      "minimum_complete_participants_for_track_decision": 0,
      "minimum_complete_stages_per_participant": 0,
      "insufficient_precision_rule": "No screened complete joint cohort exists. PCQ-J remains partial regardless of numerical closure or a successful D'Souza flow-volume comparison."
    }
  ],
  "observation_models": [
    {
      "id": "PCQ-OM-H1",
      "endpoint_ids": ["PCQ-H1"],
      "measured_quantity": "end-expiratory stage mean pulmonary arterial pressure",
      "model_quantity": "stage mean pulmonary arterial pressure at the observed cardiac-output and PAWP boundary conditions",
      "equation": "residual_mmHg = predicted_mPAP_mmHg - observed_mPAP_mmHg",
      "status": "locked-awaiting-data",
      "non_equivalence": "RVSP, systolic PAP, and echo-derived mPAP are not interchangeable with invasive mPAP."
    },
    {
      "id": "PCQ-OM-H2",
      "endpoint_ids": ["PCQ-H2"],
      "measured_quantity": "stage pulmonary vascular resistance derived from jointly measured invasive pressures and flow",
      "model_quantity": "model effective pulmonary vascular resistance at the same stage",
      "equation": "observed_PVR_WU = (observed_mPAP_mmHg - observed_PAWP_mmHg) / observed_CO_L_min",
      "status": "locked-awaiting-data",
      "non_equivalence": "A population reference PVR or a resistance fitted to these validation records is not an observed participant PVR."
    },
    {
      "id": "PCQ-OM-H3",
      "endpoint_ids": ["PCQ-H3"],
      "measured_quantity": "within-participant ordinary-least-squares mPAP versus cardiac-output slope",
      "model_quantity": "within-participant model mPAP versus observed cardiac-output slope at observed PAWP",
      "equation": "slope_difference_WU = predicted_OLS_slope_WU - observed_OLS_slope_WU",
      "status": "locked-awaiting-data",
      "non_equivalence": "A two-point peak-minus-rest ratio is diagnostic only and cannot replace the primary three-or-more-stage slope."
    },
    {
      "id": "PCQ-OM-H4",
      "endpoint_ids": ["PCQ-H4"],
      "measured_quantity": "stage pulmonary arterial compliance and resistance-compliance time derived only from a complete systolic pressure, diastolic pressure, heart-rate, and cardiac-output tuple",
      "model_quantity": "model effective compliance and resistance-compliance time at the same stage",
      "equation": "observed_compliance_mL_mmHg = (observed_CO_L_min * 1000 / observed_HR_bpm) / (observed_sPAP_mmHg - observed_dPAP_mmHg)",
      "status": "locked-awaiting-data",
      "non_equivalence": "Missing pulse-pressure inputs are not imputed and this secondary endpoint cannot substitute for a failed primary endpoint."
    },
    {
      "id": "PCQ-OM-R1",
      "endpoint_ids": ["PCQ-R1"],
      "measured_quantity": "five same-state anatomical lobe perfusion contributions normalized to sum to one",
      "model_quantity": "five frozen MEHLISSA lobe flow fractions normalized to sum to one",
      "equation": "lobe_error_fraction[i] = predicted_fraction[i] - observed_fraction[i]",
      "status": "locked-awaiting-feasibility-and-data",
      "non_equivalence": "Four pulmonary-vein territories, spatial slices, or gravity zones require a separate frozen aggregation and are not five-lobe primary observations."
    },
    {
      "id": "PCQ-OM-C1",
      "endpoint_ids": ["PCQ-C1", "PCQ-C3"],
      "measured_quantity": "hemoglobin-adjusted functional pulmonary capillary blood volume from the multiple-inspired-oxygen DLCO regression",
      "model_quantity": "frozen functional pulmonary capillary blood volume, not morphometric lumen capacity",
      "equation": "volume_ratio = model_functional_Vc_mL / observed_functional_Vc_mL",
      "status": "locked-awaiting-data",
      "non_equivalence": "Measured systemic hemoglobin correction is recorded but is not relabelled as directly measured pulmonary capillary hematocrit."
    },
    {
      "id": "PCQ-OM-C2",
      "endpoint_ids": ["PCQ-C2"],